{
  "meta": {
    "grade": "VII",
    "module_index": 2,
    "lesson_code": "VII-M2-L01",
    "title_ro": "Aplicații audio / audio-video",
    "duration_minutes": 50,
    "prerequisites": [],
    "tools": [],
    "safety_and_ethics": []
  },
  "why_this_matters": {
    "purpose_ro": "Ca să poti lucra competent cu: Aplicații audio / audio-video. În viata reala, asta te ajuta să rezolvi sarcini rapid și corect.",
    "real_life_scenarios": [
      "Trebuie să aplici audio într-un context real.",
      "Primesti o cerinta cu Aplicații audio / audio-video și trebuie să o finalizezi în timp limitat."
    ]
  },
  "competency_contract": {
    "official_specific_competencies": [
      {
        "id": "VII-1.1",
        "text_ro": "Editarea/tehnoredactarea de documente utilizand aplicații specializate"
      },
      {
        "id": "VII-1.2",
        "text_ro": "Documentarea pe diferite teme prin utilizarea aplicatiilor audio respectiv audio-video"
      }
    ],
    "i_can_statements": {
      "minim": [
        "Pot explică pe scurt ce înseamnă Aplicații audio / audio-video.",
        "Pot executa o sarcina simplă legata de Aplicații audio / audio-video urmand pași clari."
      ],
      "standard": [
        "Pot aplică conceptele-cheie din Aplicații audio / audio-video într-o sarcina completă.",
        "Pot verifică rezultatul folosind un checklist simplu."
      ],
      "performanta": [
        "Pot integra Aplicații audio / audio-video într-un produs mai complex și pot justifica alegerile.",
        "Pot identifică și corectă erori tipice (debug/quality check)."
      ]
    }
  },
  "knowledge_progression": {
    "from_general_to_specific": [
      {
        "level": "general",
        "concepts": [
          "Ce este Aplicații audio / audio-video și la ce folosește"
        ]
      },
      {
        "level": "intermediate",
        "concepts": [
          "Reguli/pași de baza în Aplicații audio / audio-video",
          "Criterii de verificare"
        ]
      },
      {
        "level": "specific",
        "concepts": [
          "audio",
          "aplicații",
          "audio-video",
          "creare",
          "deschidere"
        ]
      }
    ],
    "common_misconceptions": [
      {
        "misconception": "Confuzie frecventa în domeniul Aplicații audio / audio-video (ex: termeni asemanatori).",
        "fix_strategy": "Exemplu comparativ + checklist de verificare + demonstratie pe caz concret."
      }
    ]
  },
  "instructional_flow": {
    "hook_3min": "Întrebare: când ai folosi Aplicații audio / audio-video în viata reala?",
    "micro_lecture_8_10min": {
      "key_terms": [
        "audio",
        "aplicații",
        "audio-video",
        "creare",
        "deschidere",
        "fișiere",
        "generice",
        "gestionare"
      ],
      "explain_like_im_12": "Aplicații audio / audio-video înseamnă să urmezi pași clari ca să obtii un rezultat predictibil.",
      "rules_and_checks": [
        "Începe cu cerinta.",
        "Aplică regula/pașii corecti.",
        "Verifică rezultatul."
      ]
    },
    "worked_examples_10min": [
      {
        "example_title": "Exemplu ghidat: aplicarea Aplicații audio / audio-video",
        "steps": [
          "Identifică cerinta și datele de intrare.",
          "Aplică regula/procedura relevanta.",
          "Verifică rezultatul cu un criteriu simplu."
        ],
        "teacher_thinks_aloud": [
          "Spun cu voce tare ce verific la fiecare pas.",
          "Dacă apare o eroare, revin la pasul anterior și izolez cauza."
        ]
      }
    ],
    "guided_practice_12min": [
      {
        "task": "Reproduce exemplul ghidat pentru Aplicații audio / audio-video pe date similare.",
        "scaffold": [
          "Urmeaza pașii 1-3 din exemplu.",
          "Folosește checklist-ul de verificare."
        ],
        "success_criteria": [
          "Pașii sunt în ordine corectă",
          "Rezultatul este verificat",
          "Lucrarea este salvata/organizata conform cerintei"
        ]
      }
    ],
    "independent_practice_12min": {
      "minim": [
        {
          "task": "Sarcina simplă: executa o operație de baza în Aplicații audio / audio-video.",
          "expected_output": "Rezultat corect, verificat minimal."
        }
      ],
      "standard": [
        {
          "task": "Sarcina completă: finalizeaza o cerinta standard în Aplicații audio / audio-video.",
          "expected_output": "Produs complet + verificare."
        }
      ],
      "performanta": [
        {
          "task": "Extension: integreaza Aplicații audio / audio-video într-un mini-proiect cu 2 cerinte suplimentare.",
          "expected_output": "Produs extins + justificare scurta."
        }
      ]
    },
    "exit_ticket_3min": {
      "minim": [
        "Ce este Aplicații audio / audio-video? (1 propozitie)"
      ],
      "standard": [
        "Numește 2 concepte-cheie din Aplicații audio / audio-video și când le folosești."
      ],
      "performanta": [
        "Da un exemplu de 'greșeală tipica' în Aplicații audio / audio-video și cum o previi."
      ]
    }
  },
  "assessment": {
    "quick_quiz": {
      "items_minim": [
        {
          "type": "mcq",
          "prompt": "Ce este audio?",
          "answer_key": "MODEL_ANSWER_REQUIRED"
        },
        {
          "type": "short",
          "prompt": "Scrie o definitie scurta pentru: aplicații.",
          "answer_key": "MODEL_ANSWER_REQUIRED"
        },
        {
          "type": "mcq",
          "prompt": "Care dintre următoarele este un exemplu de Aplicații audio / audio-video?",
          "answer_key": "MODEL_ANSWER_REQUIRED"
        },
        {
          "type": "short",
          "prompt": "Numește 1 exemplu de: Aplicații audio / audio-video.",
          "answer_key": "MODEL_ANSWER_REQUIRED"
        }
      ],
      "items_standard": [
        {
          "type": "ordering",
          "prompt": "Pune în ordine pașii corecti pentru: o sarcina în Aplicații audio / audio-video.",
          "answer_key": "MODEL_ANSWER_REQUIRED"
        },
        {
          "type": "short",
          "prompt": "Explică diferenta dintre audio și aplicații în 1-2 propozitii.",
          "answer_key": "MODEL_ANSWER_REQUIRED"
        },
        {
          "type": "mcq",
          "prompt": "Care varianta respecta regula: regula de baza din Aplicații audio / audio-video?",
          "answer_key": "MODEL_ANSWER_REQUIRED"
        },
        {
          "type": "mcq",
          "prompt": "Ce se intampla dacă faci o actiune greșită în Aplicații audio / audio-video?",
          "answer_key": "MODEL_ANSWER_REQUIRED"
        }
      ],
      "items_performanta": [
        {
          "type": "scenario",
          "prompt": "Scenariu: Trebuie să aplici audio într-un context real.. Ce ai face și de ce?",
          "answer_key": "MODEL_ANSWER_REQUIRED"
        },
        {
          "type": "debug",
          "prompt": "Găsește greșeală în: PASI_GRESITI_AICI. Propune fixul.",
          "answer_key": "MODEL_ANSWER_REQUIRED"
        },
        {
          "type": "scenario",
          "prompt": "Extinde: o sarcina standard în Aplicații audio / audio-video într-o varianta mai complexa (2 cerinte în plus).",
          "answer_key": "MODEL_ANSWER_REQUIRED"
        },
        {
          "type": "short",
          "prompt": "Explică unui coleg mai mic cum să faca o sarcina în Aplicații audio / audio-video. Folosește maxim 3 pași.",
          "answer_key": "MODEL_ANSWER_REQUIRED"
        }
      ]
    },
    "homework_optional": {
      "minim": [
        "Repeta o sarcina simplă din lectia de Aplicații audio / audio-video."
      ],
      "standard": [
        "Finalizeaza o sarcina standard și verifică rezultatul (checklist)."
      ],
      "performanta": [
        "Extinde sarcina într-un mini-proiect și documenteaza pașii (5 rânduri)."
      ]
    }
  },
  "spaced_retrieval_plan": {
    "R0_end_of_lesson": [
      "1 întrebare definitorie + 1 pas din procedura"
    ],
    "R1_next_week": [
      "Task rapid: repeta procedura pe un set nou de date"
    ],
    "R2_after_3_weeks": [
      "Debug/checklist: identifică și corecteaza 1 eroare tipica"
    ]
  },
  "teacher_notes": {
    "differentiation": {
      "support": [
        "Lucru în perechi: driver/navigator",
        "Sablon de pași tipariti sau pe ecran"
      ],
      "stretch": [
        "Introduce o cerinta în plus: optimizare / justificare / calitate"
      ]
    },
    "timeboxing": [
      {
        "segment": "Hook",
        "minutes": 3
      },
      {
        "segment": "Micro-lecture",
        "minutes": 9
      },
      {
        "segment": "Worked examples",
        "minutes": 10
      },
      {
        "segment": "Guided practice",
        "minutes": 12
      },
      {
        "segment": "Independent practice",
        "minutes": 12
      },
      {
        "segment": "Exit ticket",
        "minutes": 4
      }
    ]
  }
}