{
  "meta": {
    "grade": "VIII",
    "module_index": 4,
    "lesson_code": "VIII-M4-L01",
    "title_ro": "Pagini web (editor dedicat)",
    "duration_minutes": 50,
    "prerequisites": [],
    "tools": [],
    "safety_and_ethics": []
  },
  "why_this_matters": {
    "purpose_ro": "Ca să poti lucra competent cu: Pagini web (editor dedicat). În viata reala, asta te ajuta să rezolvi sarcini rapid și corect.",
    "real_life_scenarios": [
      "Trebuie să aplici paragraf într-un context real.",
      "Primesti o cerinta cu Pagini web (editor dedicat) și trebuie să o finalizezi în timp limitat."
    ]
  },
  "competency_contract": {
    "official_specific_competencies": [
      {
        "id": "VIII-1.1",
        "text_ro": "Utilizarea foilor de calcul tabelar în vederea rezolvarii unor situatii problema simple"
      },
      {
        "id": "VIII-1.2",
        "text_ro": "Utilizarea unui editor dedicat pentru realizarea unor pagini web cu diverse teme"
      }
    ],
    "i_can_statements": {
      "minim": [
        "Pot explică pe scurt ce înseamnă Pagini web (editor dedicat).",
        "Pot executa o sarcina simplă legata de Pagini web (editor dedicat) urmand pași clari."
      ],
      "standard": [
        "Pot aplică conceptele-cheie din Pagini web (editor dedicat) într-o sarcina completă.",
        "Pot verifică rezultatul folosind un checklist simplu."
      ],
      "performanta": [
        "Pot integra Pagini web (editor dedicat) într-un produs mai complex și pot justifica alegerile.",
        "Pot identifică și corectă erori tipice (debug/quality check)."
      ]
    }
  },
  "knowledge_progression": {
    "from_general_to_specific": [
      {
        "level": "general",
        "concepts": [
          "Ce este Pagini web (editor dedicat) și la ce folosește"
        ]
      },
      {
        "level": "intermediate",
        "concepts": [
          "Reguli/pași de baza în Pagini web (editor dedicat)",
          "Criterii de verificare"
        ]
      },
      {
        "level": "specific",
        "concepts": [
          "paragraf",
          "antet",
          "baza",
          "continut",
          "corp"
        ]
      }
    ],
    "common_misconceptions": [
      {
        "misconception": "Confuzie frecventa în domeniul Pagini web (editor dedicat) (ex: termeni asemanatori).",
        "fix_strategy": "Exemplu comparativ + checklist de verificare + demonstratie pe caz concret."
      }
    ]
  },
  "instructional_flow": {
    "hook_3min": "Întrebare: când ai folosi Pagini web (editor dedicat) în viata reala?",
    "micro_lecture_8_10min": {
      "key_terms": [
        "paragraf",
        "antet",
        "baza",
        "continut",
        "corp",
        "dedicat",
        "editare",
        "editor"
      ],
      "explain_like_im_12": "Pagini web (editor dedicat) înseamnă să urmezi pași clari ca să obtii un rezultat predictibil.",
      "rules_and_checks": [
        "Începe cu cerinta.",
        "Aplică regula/pașii corecti.",
        "Verifică rezultatul."
      ]
    },
    "worked_examples_10min": [
      {
        "example_title": "Exemplu ghidat: aplicarea Pagini web (editor dedicat)",
        "steps": [
          "Identifică cerinta și datele de intrare.",
          "Aplică regula/procedura relevanta.",
          "Verifică rezultatul cu un criteriu simplu."
        ],
        "teacher_thinks_aloud": [
          "Spun cu voce tare ce verific la fiecare pas.",
          "Dacă apare o eroare, revin la pasul anterior și izolez cauza."
        ]
      }
    ],
    "guided_practice_12min": [
      {
        "task": "Reproduce exemplul ghidat pentru Pagini web (editor dedicat) pe date similare.",
        "scaffold": [
          "Urmeaza pașii 1-3 din exemplu.",
          "Folosește checklist-ul de verificare."
        ],
        "success_criteria": [
          "Pașii sunt în ordine corectă",
          "Rezultatul este verificat",
          "Lucrarea este salvata/organizata conform cerintei"
        ]
      }
    ],
    "independent_practice_12min": {
      "minim": [
        {
          "task": "Sarcina simplă: executa o operație de baza în Pagini web (editor dedicat).",
          "expected_output": "Rezultat corect, verificat minimal."
        }
      ],
      "standard": [
        {
          "task": "Sarcina completă: finalizeaza o cerinta standard în Pagini web (editor dedicat).",
          "expected_output": "Produs complet + verificare."
        }
      ],
      "performanta": [
        {
          "task": "Extension: integreaza Pagini web (editor dedicat) într-un mini-proiect cu 2 cerinte suplimentare.",
          "expected_output": "Produs extins + justificare scurta."
        }
      ]
    },
    "exit_ticket_3min": {
      "minim": [
        "Ce este Pagini web (editor dedicat)? (1 propozitie)"
      ],
      "standard": [
        "Numește 2 concepte-cheie din Pagini web (editor dedicat) și când le folosești."
      ],
      "performanta": [
        "Da un exemplu de 'greșeală tipica' în Pagini web (editor dedicat) și cum o previi."
      ]
    }
  },
  "assessment": {
    "quick_quiz": {
      "items_minim": [
        {
          "type": "mcq",
          "prompt": "Ce este paragraf?",
          "answer_key": "MODEL_ANSWER_REQUIRED"
        },
        {
          "type": "short",
          "prompt": "Scrie o definitie scurta pentru: antet.",
          "answer_key": "MODEL_ANSWER_REQUIRED"
        },
        {
          "type": "mcq",
          "prompt": "Care dintre următoarele este un exemplu de Pagini web (editor dedicat)?",
          "answer_key": "MODEL_ANSWER_REQUIRED"
        },
        {
          "type": "short",
          "prompt": "Numește 1 exemplu de: Pagini web (editor dedicat).",
          "answer_key": "MODEL_ANSWER_REQUIRED"
        }
      ],
      "items_standard": [
        {
          "type": "ordering",
          "prompt": "Pune în ordine pașii corecti pentru: o sarcina în Pagini web (editor dedicat).",
          "answer_key": "MODEL_ANSWER_REQUIRED"
        },
        {
          "type": "short",
          "prompt": "Explică diferenta dintre paragraf și antet în 1-2 propozitii.",
          "answer_key": "MODEL_ANSWER_REQUIRED"
        },
        {
          "type": "mcq",
          "prompt": "Care varianta respecta regula: regula de baza din Pagini web (editor dedicat)?",
          "answer_key": "MODEL_ANSWER_REQUIRED"
        },
        {
          "type": "mcq",
          "prompt": "Ce se intampla dacă faci o actiune greșită în Pagini web (editor dedicat)?",
          "answer_key": "MODEL_ANSWER_REQUIRED"
        }
      ],
      "items_performanta": [
        {
          "type": "scenario",
          "prompt": "Scenariu: Trebuie să aplici paragraf într-un context real.. Ce ai face și de ce?",
          "answer_key": "MODEL_ANSWER_REQUIRED"
        },
        {
          "type": "debug",
          "prompt": "Găsește greșeală în: PASI_GRESITI_AICI. Propune fixul.",
          "answer_key": "MODEL_ANSWER_REQUIRED"
        },
        {
          "type": "scenario",
          "prompt": "Extinde: o sarcina standard în Pagini web (editor dedicat) într-o varianta mai complexa (2 cerinte în plus).",
          "answer_key": "MODEL_ANSWER_REQUIRED"
        },
        {
          "type": "short",
          "prompt": "Explică unui coleg mai mic cum să faca o sarcina în Pagini web (editor dedicat). Folosește maxim 3 pași.",
          "answer_key": "MODEL_ANSWER_REQUIRED"
        }
      ]
    },
    "homework_optional": {
      "minim": [
        "Repeta o sarcina simplă din lectia de Pagini web (editor dedicat)."
      ],
      "standard": [
        "Finalizeaza o sarcina standard și verifică rezultatul (checklist)."
      ],
      "performanta": [
        "Extinde sarcina într-un mini-proiect și documenteaza pașii (5 rânduri)."
      ]
    }
  },
  "spaced_retrieval_plan": {
    "R0_end_of_lesson": [
      "1 întrebare definitorie + 1 pas din procedura"
    ],
    "R1_next_week": [
      "Task rapid: repeta procedura pe un set nou de date"
    ],
    "R2_after_3_weeks": [
      "Debug/checklist: identifică și corecteaza 1 eroare tipica"
    ]
  },
  "teacher_notes": {
    "differentiation": {
      "support": [
        "Lucru în perechi: driver/navigator",
        "Sablon de pași tipariti sau pe ecran"
      ],
      "stretch": [
        "Introduce o cerinta în plus: optimizare / justificare / calitate"
      ]
    },
    "timeboxing": [
      {
        "segment": "Hook",
        "minutes": 3
      },
      {
        "segment": "Micro-lecture",
        "minutes": 9
      },
      {
        "segment": "Worked examples",
        "minutes": 10
      },
      {
        "segment": "Guided practice",
        "minutes": 12
      },
      {
        "segment": "Independent practice",
        "minutes": 12
      },
      {
        "segment": "Exit ticket",
        "minutes": 4
      }
    ]
  }
}