{
  "meta": {
    "grade": "VI",
    "module_index": 4,
    "lesson_code": "VI-M4-L01",
    "title_ro": "Comunicare prin Internet",
    "duration_minutes": 50,
    "prerequisites": [],
    "tools": [],
    "safety_and_ethics": [
      "Nu trimite informații personale prin email sau mesaje necunoscuților.",
      "Verifică identitatea persoanelor cu care comunici online.",
      "Raportează mesajele suspecte sau hărțuirea online unui adult de încredere."
    ]
  },
  "why_this_matters": {
    "purpose_ro": "Ca să poti lucra competent cu: Comunicare prin Internet. În viata reala, asta te ajuta să rezolvi sarcini rapid și corect.",
    "real_life_scenarios": [
      "Trebuie să aplici adresa într-un context real.",
      "Primesti o cerinta cu Comunicare prin Internet și trebuie să o finalizezi în timp limitat."
    ]
  },
  "competency_contract": {
    "official_specific_competencies": [
      {
        "id": "VI-1.1",
        "text_ro": "Utilizarea eficienta a instrumentelor specializate în scopul realizarii unei prezentări"
      },
      {
        "id": "VI-1.2",
        "text_ro": "Utilizarea eficienta a instrumentelor specializate în scopul realizarii unei animații grafice"
      }
    ],
    "i_can_statements": {
      "minim": [
        "Pot explică pe scurt ce înseamnă Comunicare prin Internet.",
        "Pot executa o sarcina simplă legata de Comunicare prin Internet urmand pași clari."
      ],
      "standard": [
        "Pot aplică conceptele-cheie din Comunicare prin Internet într-o sarcina completă.",
        "Pot verifică rezultatul folosind un checklist simplu."
      ],
      "performanta": [
        "Pot integra Comunicare prin Internet într-un produs mai complex și pot justifica alegerile.",
        "Pot identifică și corectă erori tipice (debug/quality check)."
      ]
    }
  },
  "knowledge_progression": {
    "from_general_to_specific": [
      {
        "level": "general",
        "concepts": [
          "Ce este Comunicare prin Internet și la ce folosește"
        ]
      },
      {
        "level": "intermediate",
        "concepts": [
          "Reguli/pași de baza în Comunicare prin Internet",
          "Criterii de verificare"
        ]
      },
      {
        "level": "specific",
        "concepts": [
          "adresa",
          "adresare",
          "agenda",
          "atasare",
          "compunere"
        ]
      }
    ],
    "common_misconceptions": [
      {
        "misconception": "Confuzie frecventa în domeniul Comunicare prin Internet (ex: termeni asemanatori).",
        "fix_strategy": "Exemplu comparativ + checklist de verificare + demonstratie pe caz concret."
      }
    ]
  },
  "instructional_flow": {
    "hook_3min": "Întrebare: când ai folosi Comunicare prin Internet în viata reala?",
    "micro_lecture_8_10min": {
      "key_terms": [
        "adresa",
        "adresare",
        "agenda",
        "atasare",
        "compunere",
        "comunicare",
        "cont",
        "datelor"
      ],
      "explain_like_im_12": "Comunicare prin Internet înseamnă să urmezi pași clari ca să obtii un rezultat predictibil.",
      "rules_and_checks": [
        "Începe cu cerinta.",
        "Aplică regula/pașii corecti.",
        "Verifică rezultatul."
      ]
    },
    "worked_examples_10min": [
      {
        "example_title": "Exemplu ghidat: aplicarea Comunicare prin Internet",
        "steps": [
          "Identifică cerinta și datele de intrare.",
          "Aplică regula/procedura relevanta.",
          "Verifică rezultatul cu un criteriu simplu."
        ],
        "teacher_thinks_aloud": [
          "Spun cu voce tare ce verific la fiecare pas.",
          "Dacă apare o eroare, revin la pasul anterior și izolez cauza."
        ]
      }
    ],
    "guided_practice_12min": [
      {
        "task": "Reproduce exemplul ghidat pentru Comunicare prin Internet pe date similare.",
        "scaffold": [
          "Urmeaza pașii 1-3 din exemplu.",
          "Folosește checklist-ul de verificare."
        ],
        "success_criteria": [
          "Pașii sunt în ordine corectă",
          "Rezultatul este verificat",
          "Lucrarea este salvata/organizata conform cerintei"
        ]
      }
    ],
    "independent_practice_12min": {
      "minim": [
        {
          "task": "Sarcina simplă: executa o operație de baza în Comunicare prin Internet.",
          "expected_output": "Rezultat corect, verificat minimal."
        }
      ],
      "standard": [
        {
          "task": "Sarcina completă: finalizeaza o cerinta standard în Comunicare prin Internet.",
          "expected_output": "Produs complet + verificare."
        }
      ],
      "performanta": [
        {
          "task": "Extension: integreaza Comunicare prin Internet într-un mini-proiect cu 2 cerinte suplimentare.",
          "expected_output": "Produs extins + justificare scurta."
        }
      ]
    },
    "exit_ticket_3min": {
      "minim": [
        "Ce este Comunicare prin Internet? (1 propozitie)"
      ],
      "standard": [
        "Numește 2 concepte-cheie din Comunicare prin Internet și când le folosești."
      ],
      "performanta": [
        "Da un exemplu de 'greșeală tipica' în Comunicare prin Internet și cum o previi."
      ]
    }
  },
  "assessment": {
    "quick_quiz": {
      "items_minim": [
        {
          "type": "mcq",
          "prompt": "Ce este adresa?",
          "answer_key": "MODEL_ANSWER_REQUIRED"
        },
        {
          "type": "short",
          "prompt": "Scrie o definitie scurta pentru: adresare.",
          "answer_key": "MODEL_ANSWER_REQUIRED"
        },
        {
          "type": "mcq",
          "prompt": "Care dintre următoarele este un exemplu de Comunicare prin Internet?",
          "answer_key": "MODEL_ANSWER_REQUIRED"
        },
        {
          "type": "short",
          "prompt": "Numește 1 exemplu de: Comunicare prin Internet.",
          "answer_key": "MODEL_ANSWER_REQUIRED"
        }
      ],
      "items_standard": [
        {
          "type": "ordering",
          "prompt": "Pune în ordine pașii corecti pentru: o sarcina în Comunicare prin Internet.",
          "answer_key": "MODEL_ANSWER_REQUIRED"
        },
        {
          "type": "short",
          "prompt": "Explică diferenta dintre adresa și adresare în 1-2 propozitii.",
          "answer_key": "MODEL_ANSWER_REQUIRED"
        },
        {
          "type": "mcq",
          "prompt": "Care varianta respecta regula: regula de baza din Comunicare prin Internet?",
          "answer_key": "MODEL_ANSWER_REQUIRED"
        },
        {
          "type": "mcq",
          "prompt": "Ce se intampla dacă faci o actiune greșită în Comunicare prin Internet?",
          "answer_key": "MODEL_ANSWER_REQUIRED"
        }
      ],
      "items_performanta": [
        {
          "type": "scenario",
          "prompt": "Scenariu: Trebuie să aplici adresa într-un context real.. Ce ai face și de ce?",
          "answer_key": "MODEL_ANSWER_REQUIRED"
        },
        {
          "type": "debug",
          "prompt": "Găsește greșeală în: PASI_GRESITI_AICI. Propune fixul.",
          "answer_key": "MODEL_ANSWER_REQUIRED"
        },
        {
          "type": "scenario",
          "prompt": "Extinde: o sarcina standard în Comunicare prin Internet într-o varianta mai complexa (2 cerinte în plus).",
          "answer_key": "MODEL_ANSWER_REQUIRED"
        },
        {
          "type": "short",
          "prompt": "Explică unui coleg mai mic cum să faca o sarcina în Comunicare prin Internet. Folosește maxim 3 pași.",
          "answer_key": "MODEL_ANSWER_REQUIRED"
        }
      ]
    },
    "homework_optional": {
      "minim": [
        "Repeta o sarcina simplă din lectia de Comunicare prin Internet."
      ],
      "standard": [
        "Finalizeaza o sarcina standard și verifică rezultatul (checklist)."
      ],
      "performanta": [
        "Extinde sarcina într-un mini-proiect și documenteaza pașii (5 rânduri)."
      ]
    }
  },
  "spaced_retrieval_plan": {
    "R0_end_of_lesson": [
      "1 întrebare definitorie + 1 pas din procedura"
    ],
    "R1_next_week": [
      "Task rapid: repeta procedura pe un set nou de date"
    ],
    "R2_after_3_weeks": [
      "Debug/checklist: identifică și corecteaza 1 eroare tipica"
    ]
  },
  "teacher_notes": {
    "differentiation": {
      "support": [
        "Lucru în perechi: driver/navigator",
        "Sablon de pași tipariti sau pe ecran"
      ],
      "stretch": [
        "Introduce o cerinta în plus: optimizare / justificare / calitate"
      ]
    },
    "timeboxing": [
      {
        "segment": "Hook",
        "minutes": 3
      },
      {
        "segment": "Micro-lecture",
        "minutes": 9
      },
      {
        "segment": "Worked examples",
        "minutes": 10
      },
      {
        "segment": "Guided practice",
        "minutes": 12
      },
      {
        "segment": "Independent practice",
        "minutes": 12
      },
      {
        "segment": "Exit ticket",
        "minutes": 4
      }
    ]
  }
}